{
  "$schema": "https://json-schema.org/draft/2020-12/schema",
  "title": "Doctor Report",
  "type": "object",
  "additionalProperties": false,
  "required": [
    "schema_version",
    "checked_at",
    "repo_root",
    "python",
    "git",
    "required_entrypoints",
    "public_copy",
    "validator",
    "readiness",
    "warnings",
    "blockers",
    "next_actions"
  ],
  "properties": {
    "schema_version": {
      "type": "string",
      "minLength": 1
    },
    "checked_at": {
      "type": "string",
      "minLength": 1
    },
    "repo_root": {
      "type": "string",
      "minLength": 1
    },
    "python": {
      "type": "object",
      "additionalProperties": false,
      "required": [
        "executable",
        "version",
        "supported"
      ],
      "properties": {
        "executable": {
          "type": "string",
          "minLength": 1
        },
        "version": {
          "type": "string",
          "minLength": 1
        },
        "supported": {
          "type": "boolean"
        }
      }
    },
    "git": {
      "type": "object",
      "additionalProperties": false,
      "required": [
        "worktree_status",
        "head",
        "origin_main",
        "freshness"
      ],
      "properties": {
        "worktree_status": {
          "type": "string",
          "minLength": 1
        },
        "head": {
          "type": "string",
          "minLength": 1
        },
        "origin_main": {
          "type": "string",
          "minLength": 1
        },
        "freshness": {
          "enum": [
            "fresh",
            "stale",
            "unknown"
          ]
        }
      }
    },
    "required_entrypoints": {
      "type": "array",
      "minItems": 1,
      "items": {
        "type": "object",
        "additionalProperties": false,
        "required": [
          "path",
          "status"
        ],
        "properties": {
          "path": {
            "type": "string",
            "minLength": 1
          },
          "status": {
            "enum": [
              "present",
              "missing"
            ]
          }
        }
      }
    },
    "public_copy": {
      "type": "object",
      "additionalProperties": false,
      "required": [
        "readme_exposes_local_scrub_command",
        "root_agent_docs_expose_local_scrub_command"
      ],
      "properties": {
        "readme_exposes_local_scrub_command": {
          "type": "boolean"
        },
        "root_agent_docs_expose_local_scrub_command": {
          "type": "boolean"
        }
      }
    },
    "validator": {
      "type": "object",
      "additionalProperties": false,
      "required": [
        "status",
        "error_count",
        "errors"
      ],
      "properties": {
        "status": {
          "enum": [
            "pass",
            "fail"
          ]
        },
        "error_count": {
          "type": "integer",
          "minimum": 0
        },
        "errors": {
          "type": "array",
          "items": {
            "type": "string"
          }
        }
      }
    },
    "readiness": {
      "enum": [
        "pass",
        "warn",
        "blocked"
      ]
    },
    "warnings": {
      "type": "array",
      "items": {
        "type": "string"
      }
    },
    "blockers": {
      "type": "array",
      "items": {
        "type": "string"
      }
    },
    "next_actions": {
      "type": "array",
      "minItems": 1,
      "items": {
        "type": "string",
        "minLength": 1
      }
    }
  }
}
